{
  "$schema": "https://json-schema.org/draft/2020-12/schema",
  "$id": "urn:musiam:media:source:v1",
  "type": "object",
  "additionalProperties": false,
  "required": [
    "schemaVersion",
    "id",
    "source",
    "idea",
    "evidence",
    "cta",
    "outputs"
  ],
  "properties": {
    "schemaVersion": {
      "const": 1
    },
    "id": {
      "type": "string",
      "pattern": "^[a-z0-9-]{1,80}$"
    },
    "source": {
      "type": "object",
      "additionalProperties": false,
      "required": [
        "path",
        "sha256"
      ],
      "properties": {
        "path": {
          "type": "string",
          "pattern": "^content/letters/[a-z0-9-]+\\.md$"
        },
        "sha256": {
          "type": "string",
          "pattern": "^[a-f0-9]{64}$"
        }
      }
    },
    "idea": {
      "type": "string",
      "minLength": 1
    },
    "evidence": {
      "type": "array",
      "minItems": 1,
      "items": {
        "type": "object",
        "additionalProperties": false,
        "required": [
          "id",
          "text"
        ],
        "properties": {
          "id": {
            "type": "string",
            "minLength": 1
          },
          "text": {
            "type": "string",
            "minLength": 1
          }
        }
      }
    },
    "cta": {
      "type": "object",
      "additionalProperties": false,
      "required": [
        "route",
        "label",
        "evidenceId",
        "reason"
      ],
      "properties": {
        "route": {
          "type": "string",
          "minLength": 1
        },
        "label": {
          "type": "string",
          "minLength": 1
        },
        "evidenceId": {
          "type": "string",
          "minLength": 1
        },
        "reason": {
          "type": "string",
          "minLength": 1
        }
      }
    },
    "outputs": {
      "type": "array",
      "minItems": 8,
      "items": {
        "type": "object",
        "additionalProperties": false,
        "required": [
          "channel",
          "format",
          "blocks"
        ],
        "properties": {
          "channel": {
            "enum": [
              "letter",
              "intelligence-underground",
              "seo-article",
              "x",
              "threads",
              "instagram",
              "short-video",
              "newsletter"
            ]
          },
          "format": {
            "type": "string",
            "minLength": 1
          },
          "blocks": {
            "type": "array",
            "minItems": 2,
            "items": {
              "type": "object",
              "additionalProperties": false,
              "required": [
                "kind",
                "text",
                "evidenceIds"
              ],
              "properties": {
                "kind": {
                  "enum": [
                    "QUOTE",
                    "FACT",
                    "INFERENCE"
                  ]
                },
                "text": {
                  "type": "string",
                  "minLength": 1
                },
                "evidenceIds": {
                  "type": "array",
                  "minItems": 1,
                  "items": {
                    "type": "string",
                    "minLength": 1
                  }
                }
              }
            },
            "maxItems": 10
          }
        }
      },
      "maxItems": 8
    }
  }
}
