{
  "schemaVersion": 1,
  "id": "museum-not-label",
  "source": {
    "path": "content/letters/2025-01-03-why-a-museum-not-a-label.md",
    "sha256": "150234826ecec1c7ae9be5efce613230d88ad58263437a5af2992634beb4fd82"
  },
  "idea": "作品単品ではなく、歩いて回れる世界として音楽を収蔵する。",
  "evidence": [
    {
      "id": "museum",
      "text": "レーベルは商品を出荷する。館は、世界を収蔵する。"
    },
    {
      "id": "world",
      "text": "バラ売りの新譜ではなく、歩いて回れる世界。"
    }
  ],
  "cta": {
    "route": "/letters/2025-01-03-why-a-museum-not-a-label",
    "label": "館という名前の理由を読む",
    "evidenceId": "world",
    "reason": "作品を世界として見る主題を、元のLetterで読み返す。販売条件を足さない。"
  },
  "outputs": [
    {
      "channel": "letter",
      "format": "原文を置換しない紹介Letter seed",
      "blocks": [
        {
          "kind": "FACT",
          "text": "2025-01-03のLetter：なぜ「レーベル」ではなく「館」なのか",
          "evidenceIds": [
            "world"
          ]
        },
        {
          "kind": "INFERENCE",
          "text": "曲を並べる棚ではなく、曲の間を歩く館。最初の構想を読み返すための短い入口。",
          "evidenceIds": [
            "world"
          ]
        }
      ]
    },
    {
      "channel": "intelligence-underground",
      "format": "調査問い・仮説・未調査",
      "blocks": [
        {
          "kind": "QUOTE",
          "text": "レーベルは商品を出荷する。館は、世界を収蔵する。",
          "evidenceIds": [
            "museum"
          ]
        },
        {
          "kind": "INFERENCE",
          "text": "仮説：作品間の関係を辿れる展示は、単品紹介とは異なる聴き方を生むかもしれない。",
          "evidenceIds": [
            "world"
          ]
        },
        {
          "kind": "INFERENCE",
          "text": "調査課題：展示の順路とアルバムの曲順を比較する。実例・反例・来訪者の声は未収集。効果はまだ主張しない。",
          "evidenceIds": [
            "world"
          ]
        }
      ]
    },
    {
      "channel": "seo-article",
      "format": "検索意図仮説・見出し案",
      "blocks": [
        {
          "kind": "FACT",
          "text": "2025-01-03のLetter：なぜ「レーベル」ではなく「館」なのか",
          "evidenceIds": [
            "world"
          ]
        },
        {
          "kind": "INFERENCE",
          "text": "記事案：音楽を館として見せるとは。MUSIAMの名付けと、作品の間に道を作る考え方を読む。",
          "evidenceIds": [
            "world"
          ]
        },
        {
          "kind": "INFERENCE",
          "text": "構成案：名前の由来／単品と世界の違い／実際の展示で確かめること。検索需要は未測定。既存Letterと重複するだけなら記事化しない。",
          "evidenceIds": [
            "world"
          ]
        }
      ]
    },
    {
      "channel": "x",
      "format": "短い対比",
      "blocks": [
        {
          "kind": "QUOTE",
          "text": "レーベルは商品を出荷する。館は、世界を収蔵する。",
          "evidenceIds": [
            "museum"
          ]
        },
        {
          "kind": "INFERENCE",
          "text": "新譜を一枚選ぶ前に、曲と曲の間を歩いてみる。MUSIAMを館として読む入口。",
          "evidenceIds": [
            "world"
          ]
        }
      ]
    },
    {
      "channel": "threads",
      "format": "会話の問い",
      "blocks": [
        {
          "kind": "QUOTE",
          "text": "バラ売りの新譜ではなく、歩いて回れる世界。",
          "evidenceIds": [
            "world"
          ]
        },
        {
          "kind": "INFERENCE",
          "text": "曲順を辿るのと、展示室を巡るのは似ているだろうか。作品同士の距離まで味わう聴き方を考えてみたい。あなたなら、どんな道を作る？",
          "evidenceIds": [
            "world"
          ]
        }
      ]
    },
    {
      "channel": "instagram",
      "format": "カルーセル3枚・キャプション",
      "blocks": [
        {
          "kind": "INFERENCE",
          "text": "1枚目：音楽の館に、道を引く。",
          "evidenceIds": [
            "world"
          ]
        },
        {
          "kind": "QUOTE",
          "text": "バラ売りの新譜ではなく、歩いて回れる世界。",
          "evidenceIds": [
            "world"
          ]
        },
        {
          "kind": "INFERENCE",
          "text": "3枚目：一曲から隣の一曲へ。余白を順路に見立てた、文字だけのカルーセル案。",
          "evidenceIds": [
            "world"
          ]
        },
        {
          "kind": "INFERENCE",
          "text": "キャプション案：作品を一つ選ぶ日も、世界を歩く日もある。このLetterは後者の入口。画像は未制作。誘導先は掲載時に確認する。",
          "evidenceIds": [
            "world"
          ]
        }
      ]
    },
    {
      "channel": "short-video",
      "format": "30秒台本案・素材未制作",
      "blocks": [
        {
          "kind": "INFERENCE",
          "text": "0–5秒／画面：点を一つ。語り：一曲は、入口になる。",
          "evidenceIds": [
            "world"
          ]
        },
        {
          "kind": "QUOTE",
          "text": "レーベルは商品を出荷する。館は、世界を収蔵する。",
          "evidenceIds": [
            "museum"
          ]
        },
        {
          "kind": "INFERENCE",
          "text": "5–20秒／画面：点と点を線でつなぐ。語り：曲の間に道があれば、聴く時間は散歩に近づくかもしれない。",
          "evidenceIds": [
            "world"
          ]
        },
        {
          "kind": "INFERENCE",
          "text": "20–30秒／画面：MUSIAMの文字。語り：館という名前の理由を、Letterで読む。音源・写真の権利確認と尺読みは未実施。",
          "evidenceIds": [
            "world"
          ]
        }
      ]
    },
    {
      "channel": "newsletter",
      "format": "件名・本文案",
      "blocks": [
        {
          "kind": "INFERENCE",
          "text": "件名案：新譜の棚から、歩ける館へ",
          "evidenceIds": [
            "world"
          ]
        },
        {
          "kind": "FACT",
          "text": "2025-01-03のLetter：なぜ「レーベル」ではなく「館」なのか",
          "evidenceIds": [
            "world"
          ]
        },
        {
          "kind": "QUOTE",
          "text": "レーベルは商品を出荷する。館は、世界を収蔵する。",
          "evidenceIds": [
            "museum"
          ]
        },
        {
          "kind": "INFERENCE",
          "text": "今回読み返したのは、MUSIAMの名前をめぐる短い手紙。作品同士の道を考えるきっかけに、一通だけ届ける。返信で聴き方を教えてもらう案。購読者への送信は未実施。",
          "evidenceIds": [
            "world"
          ]
        }
      ]
    }
  ]
}
